<?xml version="1.0" encoding="UTF-8"?>
<personas xmlns:xsi="http://www.w3.org/2001/XMLSchema-instance" xsi:noNamespaceSchemaLocation="personas.xsd">

	<persona>

		<nombre>Juan Pardo</nombre>

		<nacimiento dia="10" mes="Abril" anyo="1982"/>

		<direcciones>
			<direccion>
				<calle>Caoba, 1</calle>
				<poblacion>Madrid</poblacion>
				<provincia>Madrid</provincia>
				<cpostal>28005</cpostal>
			</direccion>

		</direcciones>

		<varon/>

	</persona>


	<persona>

		<nombre>Maria Lopez</nombre>

		<nacimiento dia="10" mes="Abril" anyo="1982"/>

		<direcciones>
			<direccion>
				<calle>Roncato,1</calle>
				<poblacion>Illescas</poblacion>
				<provincia>Toledo</provincia>
				<cpostal>45200</cpostal>
			</direccion>

			<direccion>
				<calle>Paseo de la Esperanza 15, 1ÂºA</calle>
				<poblacion>Madrid</poblacion>
				<provincia>Madrid</provincia>
				<cpostal>28005</cpostal>
			</direccion>

		</direcciones>

		<mujer/>

	</persona>

</personas>
